selling," Author: K. KHASANOV, participant of the XVI session of the Supreme Council of the Republic of Tajikistan  11/14/2007 Source - Asia-plus  The permanent address of the article is https://centrasia.org/newsA.php?st=1195112160  News of Kazakhstan  - Working schedule of the head of state  - Maulen Ashimbaev: Kazakhstan continues to implement a balanced multi-vector foreign policy  - Bills on healthcare, housing and communal services and bankruptcy were approved in the Mazhilis  - Alikhan Smailov held a meeting of the Commission on Demonopolization of the Economy  - Agreements for $2.5 billion were signed at the Uzbek-Kazakh business forum in Tashkent  - ""Ak Zhol"" demands to eliminate unnecessary intermediaries between energy companies and consumers  - Yerulan Zhamaubayev held a meeting on national projects  - Regional conferences of ""AMANAT"" party branches started  - The visit of the Minister of Foreign Affairs of the Republic of Kazakhstan to London continues  - In Kazakhstan, it is planned to extend the maximum prices for the retail sale of petroleum products, for which state price regulation is established",A0_pag_Seller,suggestion,A1_ppt_Thing_Sold,petroleum products,A2_gol_Buyer,retail sale,maximum prices
love," The previous day an official UNMOT delegation comprising military and civilian members took part in the remembrance and burial ceremony of their loved colleague, Jorajon Mahramov. In the ceremony -- attended by all UN staff in Dushanbe as well as delegations from the countries of the deceased and friends from the international community and Tajik society -- the SRSG said a last farewell on behalf of all UNMOT members to our loved colleagues.",A0_pag_lover,UNMOT members,A1_ppt_loved,son
hunger, Hunger and Hardship in the Tajikistan Civil War  The Tajikistan economy collapsed during the civil war. Hunger and Hardship in the Tajikistan Civil War  The Tajikistan economy collapsed during the civil war.,A1_ppt_hungry_for,Hardship
appropriation," Some of the disappeared were believed to have been brought to informal prisons, or buildings appropriated by warlords and used as detention centers for their captives.",A0_pag_taker_of_possession,warlords,A1_ppt_entity_appropriated,buildings
re-election," We, the members of the Presidium of the Supreme Council and the Government of the Republic, announce the resignation of our powers in order to enable people's deputies to elect a new composition of the Presidium of the Supreme Council and the Government of the Republic at the next session of the Supreme Council.",A0_pag_voters,representatives,A1_ppt_candidate,deputies
income," The cost of transporting weapons and supplies to Tajikistan were high, plus Russian soldiers earned triple pay for duty in Tajikistan.",A0_pag_earner,Russian soldiers,A1_ppt_wages,Russian soldiers,A2_gol_benefactive,Russian soldiers
military_occupation, Returnees are living in appalling conditions in mosques because their homes were either burned or are occupied .,A1_ppt_occupied,homes
charity, Individual countries and international organizations would continue to help Tajikistan in the years that followed to help alleviate the damage done to the country during the civil war and prevent the conflict from returning.,A0_pag_helper,international organizations,A1_ppt_project,suggestion,A2_gol_benefactive,the years that followed
taking_office," All you need to do is sign up and start playing. Before you start playing online, make sure to sign up for a trusted gambling site.",A0_pag_Agent,you,A1_ppt_Theme,playing
script," The editorial offices of Adolat (Equality), the DPT newspaper, and Charogi Ruz (Light of Day), an independent newspaper, were ransacked ; their writers and editors went into exile.",A0_pag_writer,writers and editors,A1_ppt_thing_written,"editorial offices of Adolat (Equality), the DPT newspaper, and Charogi Ruz (Light of Day), an independent newspaper"
precipitation," After some time the political foes settled into two opposing coalitions: the incumbent leadership dominated by elites from Leninobod along with their primary junior partners from Kulob and Hisor, and the opposition coalition that included new political parties such as the mostly urban Democratic Party of Tajikistan, the Gharmi Tajik-dominated Islamic Revival Party, and the Pamiri party La'li Badakhshon.",A0_pag_metaphorical_agent,political foes,A1_ppt_metaphorical_rain,settled,A2_gol_rained_upon,political foes
confirmation," I want my resignation to be confirmed by Parliament.""",A1_ppt_thing_confirmed,release of the chairman of the Kurgan-Tyube regional executive committee Aslonov,A2_gol_benefactive,legislature
urban_renewal," Kirill Nourzhanov and Christian Bleuer wrote: ""At the end of 1992 the armed opposition suffered a heavy defeat and fled to mountainous areas of eastern Tajikistan and, importantly, to a safe haven in Afghanistan, where the 'Islamic' opposition attempted to regroup . Kirill Nourzhanov and Christian Bleuer wrote: ""At the end of 1992 the armed opposition suffered a heavy defeat and fled to mountainous areas of eastern Tajikistan and, importantly, to a safe haven in Afghanistan, where the 'Islamic' opposition attempted to regroup .",A0_pag_reclaimer,political foes,A1_ppt_entity_reclaimed,safe haven,A2_dir_entity_reclaimed_from,Afghanistan
stoning, One Russian man was captured by gangs and impaled on a fence.,A0_pag_thrower,gangs
equilibrium, The balance of power in this 'government alliance' shifted to the Kulobis as the war continued.,A1_ppt_thing_balanced,power,A2_ppt_in_comparison_to,political foes
light_scattering," Scattered fighting continued into the spring of 1997, however. Scattered fighting continued into the spring of 1997, however.",A1_ppt_thing_distributed,political foes
come," Nasriddinov followed me, when they came out onto Ordzhonikidze Street, I said: ""Zainiddin, it seems that the worst is left behind,"" but he did not answer.",A4_gol_end_point,Ordzhonikidze Street
presence," In addition, he stated that the MVD was most likely aware of the general pattern of disappearances and the reported existence of so-called ""informal prisons.""",A1_pag_entity_present,"existence of so-called ""informal prisons."""
explanation, It is difficult to explain all this briefly.,A1_ppt_thing_explained,all this
reporting, It was also reported that the presidents of the CIS countries are ready to participate in the session.,A1_ppt_thing_reported,presidents
publishing," I decided to cite the answers of two of them, now deceased, honored residents of the city of Dushanbe, published in the People's Newspaper.",A0_pag_publisher,two of them,A1_prd_book,answers
divergence, Words diverged from thoughts and real deeds.,A1_ppt_second_entity,thoughts and real deeds
contributing_factor," [Source: ""Tajikistan: Political and Social History"" by Kirill Nourzhanov and Christian Bleuer, Australia National University, 2013 ><]  ""The largest contribution to the opposition's demonstrations was by the Islamic Revival Party (IRP). [Source: ""Tajikistan: Political and Social History"" by Kirill Nourzhanov and Christian Bleuer, Australia National University, 2013 ]  ""The largest contribution to the opposition's demonstrations was by the Islamic Revival Party (IRP).",A1_ppt_thing_given,demonstrations
amenity," CIS forces also helped provided security to UNMOT, the Organization for Security and Cooperation in Europe (OSCE), and personnel of other international organizations.",A1_ppt_thing_provided,security,A2_gol_entity_provided_for,personnel of other international organizations
whispering," In late January 1996, President Boris Yeltsin spoke about Russia's commitment to Tajikistan, the Russian troops deployed there, and the financial help Russia was providing Tajikistan.",A0_pag_speaker,President Boris Yeltsin,A1_ppt_utterance,Russia's commitment
manual_work," The SRSG asserted that these men were killed when they had been fully assured, by those who could give these assurances, of creating conditions for their safe work .",A0_pag_worker,UNMOT colleagues,A1_ppt_job,performing
naturalistic_observation," But, sitting on the balcony for the press, one could observe the active movement of the deputies, who either went out somewhere, or argued about something among themselves.",A0_ppt_observer,one,A1_pag_thing_looked_at,activities
scheduling," A final report, Human Rights in Tajikistan: In the Wake of the Civil War, was scheduled for publication in December.",A1_prd_thing_scheduled,humanitarian law violations,A2_prd_scheduled_to,publication,A3_tmp_time_of_event,December
role-playing," Ethnicity, religion, social organisation, migration, state-building, politics and economics in Tajikistan (especially during the Soviet era)"" all "" played a role in shaping the loyalties and actions of individuals and groups during the prewar era through to the outbreak of conflict. Each one of these categories played a role in determining behaviour during the civil war—of course some of them to a far lesser degree than others."" Further, the 201st Motorized Rifle Division played a strategic role in the civil war by providing material support to the Kuliabi-based paramilitary groups. Each one of these categories played a role in determining behaviour during the civil war—of course some of them to a far lesser degree than others."" Ethnicity, religion, social organisation, migration, state-building, politics and economics in Tajikistan (especially during the Soviet era)"" all "" played a role in shaping the loyalties and actions of individuals and groups during the prewar era through to the outbreak of conflict.",A0_pag_actor,suggestion,A1_ppt_role,determining behaviour during the civil war
raid, It was not unusual for more than 25 Russian border guards to be killed in a single raid . It was not unusual for more than 25 Russian border guards to be killed in a single raid .,A0_pag_raider,Russian troops,A1_loc_raided,raid
reporting," Officials of the republic reported that in 1997-2000.  the country received over a billion dollars from the arms trade, but it was emphasized that the trade was carried out only on a legal basis.",A1_ppt_thing_reported,that the trade was carried out only on a legal basis
release_from_prison, Four of the letters were released to the press.,A1_ppt_theme_thing_released,the press
periodic_motion, The United Tajik Opposition (UTO) was an amalgam of nationalist and Islamist parties and movements .,A0_pag_agent,nationalist and Islamist parties and movements
leaching, Children scavenged through garbage dumps.,A1_ppt_soluble_constituents,garbage
buy, Working couples earned enough money when paid to buy a loaf of bread a day to feed their families But they weren't paid. Working couples earned enough money when paid to buy a loaf of bread a day to feed their families But they weren't paid.,A1_ppt_thing_bought,loaf of bread,A2_dir_seller,paid,A3_vsp_price_paid,paid,their families
feeding, Working couples earned enough money when paid to buy a loaf of bread a day to feed their families But they weren't paid.,A1_ppt_food,loaf of bread,A2_gol_eater,families
dying," Legacy of the Tajikistan Civil War  Timur Zulfikarov, the respected Tajik writer, wrote: ""An old dusty Tajik in Dushanbe said: 'If a single man dies of Perestroika, then what is this Perestroika for?' Legacy of the Tajikistan Civil War  Timur Zulfikarov, the respected Tajik writer, wrote: ""An old dusty Tajik in Dushanbe said: 'If a single man dies of Perestroika, then what is this Perestroika for?'",A1_ppt_the_deceased,man
false_imprisonment," Sudan has sought to censor news coverage of protests, and journalists reporting on the demonstrations risk life imprisonment and the death penalty.",A1_ppt_criminal,journalists,A2_ext_term,death penalty,A3_cau_cause,news coverage of protests
objection," But the organizers of the protests, the Alliance for Freedom and Change, which brings together the different groups opposed to Bashir, rejected the measures of the military, arguing that it is a ""coup led by the regime"" and called for the continuation of the demonstrations.",A0_pag_complainer,organizers,A1_ppt_thing_objected_to,measures of the military
birth, That means she cannot get Marwa a birth certificate.,A1_ppt_child,Marwa
outreach, The Sudan Rapid Support Forces offered to hold elections with international observers and in accordance with the law.,A1_ppt_commodity,elections,A2_vsp_price,international observers,A3_gol_benefactive_or_entity_offered_to,international observers
assault, A military-backed prosecutor said no rapes or sexual assaults took place during the violence.,A0_pag_assaulter,military-backed prosecutor,A1_ppt_entity_assaulted,rape
butchering," A paramilitary unit he was in charge of, the Rapid Support Forces, with links to the notorious Janjaweed militia, was involved in the mass rape and butchery of civilians while battling rebels in Darfur.",A0_pag_killer,group,A1_ppt_corpse,civilians
resist," It also vowed to "" resist "" by peaceful means all the extraordinary measures the military has imposed since Thursday's ouster of al-Bashir, including the nighttime curfew and state of emergency.",A1_ppt_thing_resisted,measures of the military
development," Abdelsalam said the two-year transition period announced by the military council ""could be shortened depending on developments on the ground and agreements between stakeholders.""",A1_loc_location,the development
lift," She hurt herself, lifting heavy objects and throwing herself off furniture, hoping for a miscarriage.",A1_ppt_Logical_subject,heavy objects
management," ""There is no military officer up until the rank of lieutenant general who was not a part of the NCP which penetrated... and managed all sectors of society.",A0_pag_manager,military officer,A1_ppt_thing_managed,NCP
outreach," CNN exclusive: As Sudan brutalizes its people, the US offers closer relations  Those jubilant scenes came to an abrupt halt after the coup announcement, however, according to a CNN stringer on the ground.",A0_pag_entity_offering,US,A1_ppt_commodity,closer relations,A3_gol_benefactive_or_entity_offered_to,military council
intimacy," Sudanese protesters cheer Thursday for passing soldiers near military headquarters in Khartoum. Salih Basheer/AP Demonstrators rally near the military headquarters in Khartoum on April 15. AFP/Getty Images Sudanese soldiers transport a body near the military headquarters on Tuesday, April 9.",A1_pag_near_entity,peaceful protesters,A2_ppt_in_relation_to,military headquarters
anti-discrimination," AFP/Getty Images People take part in an anti -government demonstration in Omdurman, Sudan, on January 29. AFP/Getty Images A protester retreats from tear gas during an anti -government demonstration on February 24. AFP/Getty Images A billboard in Khartoum bears an image of Alaa Salah, a Sudanese woman who became the face of anti -government demonstrations.",A0_ppt_opposer,billboard
suspension," ""I announce a month-long curfew (every day) from 10:00 pm to 04:00 (local time),"" said Defense Minister Awad Ibnouf, who previously decreed the suspension of the Constitution, the closure of the borders and airspace, and the state of emergency throughout the country, reported AFP. In his brief spell as head of state the former vice-president and defence chief declared a three-month state of emergency, suspended the constitution, arrested a few senior officials and announced a curfew. The defense minister has announced the suspension of the Constitution and the creation of a military council that will lead the country for the next two years. The army arrested al-Bashir, imposed a state of emergency that includes a nighttime curfew, suspended the constitution and closed the country's borders. The army suspended the constitution and announced the start of a transitional period.",A0_pag_liquefier,al-Bashir,A1_ppt_thing_being_transformed,the Constitution,A2_prd_end_state,the Constitution
voting, He spoke at a council meeting after members voted unanimously to extend the U.N.,A0_pag_agent_voter,members,A1_ppt_theme_candidate_or_ballot_issue,extend the U.N.,A2_prd_result_numerical_count_of_vote,members
identification," It ""found a number of crimes, including rape, that were committed during the dispersal, and also identified some suspects"", he said, refusing to give details.",A1_ppt_thing_changing,a number of crimes,A2_gol_target,the development
reading," https://ria.ru/20190413/1552663837.html  Глава разведки Судана podал в отставку, сообщили СМИ  Глава разведки Судана podал в отставку, сообщили СМИ - РИА Новости, 04.13.2019  Глава разведки Судана podал в отставку, сообщили СМИ  Переходный военный совет Судана заявил об отставке главы Национальной службы безопасности и разведба (NISS) лабали ly, read radio Omdurman. Переходный военный совет Судана заявил об отставке главы Национальной службы безопасности и разведба (NISS) лабали ly, read radio Omdurman.",A0_pag_discussant,radio Omdurman
neck_injury," These dead are added to another 60 reported by the CCM, in addition to at least 326 injured in the clashes.",A0_ppt_agent,bodies,A1_ppt_injured_entity,another 60 reported by the CCM
coitus_interruptus," The two sides, which resumed talks this week after a monthlong hiatus that included a bloody crackdown by the military, have agreed to form a joint military-civilian authority to run Sudan during an interim period of just over three years, a senior protest leader said.",A0_pag_causal_agent,protest leaders,A1_ppt_entity_leaving,two sides,A2_dir_place_left,deal
abscission," ""Those who destroyed the country and killed its people want to appropriate every drop of blood shed by the great people of Sudan during their revolution,"" it said.",A0_dir_entity_removing,military council,A1_ppt_thing_being_removed,blood
amenity, He says al-Bashir is in custody but declined to provide more details.,A1_ppt_thing_provided,the development
artistic_creation," The statement, cited by RIA Novosti, also proposed the creation of a transitional council of ministers, which would include both military and civilians. The defense minister has announced the suspension of the Constitution and the creation of a military council that will lead the country for the next two years. A Sudanese military junta announced on Thursday the dismissal of President Omar al Bashir, and also the creation of a Military Council that will remain in office for two years, arousing the rejection of the protest organizers who for four months called for the resignation of the president. The Sovereign Council, made up of military officers and civilians from the protest movement, was created to govern until the end of 2022. A temporary military council was created in the country, it will rule for two years. Fight for democracy  The protest movement, which began in 2018, succeeded in overthrowing longtime ruler, President Omar al-Bashir, in April 2019 and forcing the creation of a joint civilian-military ruling ""sovereign council"".",A0_pag_creator,military council,A1_ppt_thing_created,military council
undershoot, An independent commission investigating the violence already missed one deadline in February for releasing its conclusions.,A1_ppt_missed,deadline
attack," The statement, released Tuesday night, June 4, 2019, noted that Sudan's military council ""jeopardized the transition process and peace in Sudan"" by ordering attacks on protesters.",A0_pag_attacker,military council,A1_ppt_entity_attacked,peaceful protesters
identification," It "" found a number of crimes, including rape, that were committed during the dispersal, and also identified some suspects"", he said, refusing to give details.",A1_ppt_thing_changing,a number of crimes,A2_gol_target,rape
criminal_investigation, The former president of Sudan who was ousted by the country's military after months of protests is now reportedly under investigation for money laundering after large amounts of cash were discovered at his home. The former president of Sudan who was ousted by the country's military after months of protests is now reportedly under investigation for money laundering after large amounts of cash were discovered at his home.,A1_ppt_examined,money laundering
taking_office," In total, 49 people have died in violence linked to the demonstrations since the start of the rallies, according to official officials.",A0_pag_Agent,people,A1_ppt_Theme,violence
genocide," CLICK HERE FOR THE FOX NEWS APP  He is wanted by the International Criminal Court for genocide and crimes against humanity for horrors committed in neighboring Darfur, but the military to-date has stopped short of agreeing to hand him over to The Hague. Al-Bashir is wanted by the International Criminal Court, where he faces charges of war crimes, crimes against humanity and genocide for his deadly campaign against insurgents in Darfur. Mr Auf has had sanctions placed on him by America for his role in war crimes (his former boss has been indicted by the International Criminal Court for genocide in Sudan's Darfur region). sanctions list for Darfur genocide , was sworn in as head of the new military transitional council that has taken charge for the next two years. The leader was indicted by the International Criminal Court (ICC) after allegations of genocide in Sudan's Darfur region surfaced.",A0_pag_agent,al-Bashir,A1_ppt_entity/people_undergoing_genocide,allegations of genocide
support," Yasuyoshi Chiba/AFP/Getty Images Mohamed Hamdan Dagalo, deputy head of Sudan's ruling Transitional Military Council (TMC) and commander of the Rapid Support Forces (RSF) paramilitaries, center right, waves a baton as he rides through supporters in Qarri, north of Khartoum, on June 15.",A0_pag_helper,supporters,A1_ppt_person,Dagalo
recording," But over the past year, activists have been documenting what they say was a campaign of rapes ordered by the military's leadership to crush the pro-democracy movement.",A0_pag_recorder,activists,A1_ppt_record,rape
political_movement, The women's ordeal embodies the terrible personal price paid by activists in crackdowns that have crushed pro-democracy movements around the Middle East in recent years.,A0_pag_group_of_people_starting_a_revolution,rape,A1_ppt_the_revolution,pro-democracy movements
involvement," A paramilitary unit he was in charge of, the Rapid Support Forces, with links to the notorious Janjaweed militia, was involved in the mass rape and butchery of civilians while battling rebels in Darfur.",A0_pag_causer_of_inclusion,group,A1_ppt_theme,mass rape and butchery of civilians
grappling_hold," crisis in sudan  A Sudanese protester holds a national flag as he stands at a barricade along a street, demanding that the country's Transitional Military Council hand over power to civilians, in Khartoum, Sudan, June 5, 2019.",A1_ppt_thing_held,a national flag
imposition," Sudan's army imposed a nighttime curfew across the country on Thursday, after ousting veteran President Omar al-Bashir, who had been in power for three decades. Thousands kept up their sit-in outside the military headquarters in Khartoum overnight and into Friday morning despite a curfew imposed by the army after it arrested al-Bashir. It also vowed to ""resist"" by peaceful means all the extraordinary measures the military has imposed since Thursday's ouster of al-Bashir, including the nighttime curfew and state of emergency. The army arrested al-Bashir, imposed a state of emergency that includes a nighttime curfew, suspended the constitution and closed the country's borders.",A0_pag_imposer,army,A1_ppt_thing_imposed,nighttime curfew,A2_gol_imposed_on,military council
release_from_prison," The Sudanese Intelligence Agency said it ordered the release of all political detainees, the official Sudan News Agency, or SUNA, reported Thursday.",A1_ppt_theme_thing_released,detainees
reporting, The Central Committee of Physicians reported that at least 100 people have died after the violent crackdown  The latest reports released by the organizers of the opposition protests announced that 40 bodies were collected from the banks of the Nile River in Khartoum.,A0_pag_Reporter,organizers of the opposition protests,A1_ppt_thing_reported,MILITARY RULERS
intimacy, Ebrahim Hamid/AFP/Getty Images Relatives of three Sudanese men who were found dead with bullet wounds mourn near their bodies in the city of Omdurman on July 1.,A1_pag_near_entity,Relatives,A2_ppt_in_relation_to,bodies
trial," Earlier on Friday, the military council said Bashir would not be extradited but could instead be tried in Sudan.",A0_pag__litigant,military council,A1_ppt__entity_tried,al-Bashir,A2_gol__adjudicator,military council,extradited
knife_fight," In addition, the Sudan Rapid Support Forces intend to form courts and the Prosecutor General's Office to fight corruption in all forms and manifestations, the document says.",A0_pag_fighter,group,A1_ppt_thing_repelled,corruption
rally, AP Photo Sudanese army soldiers gather as people rally in front of the Presidential Palace in downtown Khartoum on May 18.,A0_pag_summoner,Sudanese soldiers,A1_ppt_summoned,peaceful protesters
hiatus," It may also miss a new deadline, June 22, because work has halted amid the coronavirus pandemic, said the commission's head Nabil Adib.",A0_pag_causer_of_stopping,work,A1_ppt_Theme,deadline
rally, Salih Basheer/AP Demonstrators rally near the military headquarters in Khartoum on April 15.,A0_pag_summoner,peaceful protesters,A1_ppt_summoned,military headquarters,A2_cau_cause,near the military headquarters in Khartoum on April 15
