gathering," Its local governance powers included gathering statistical data, such as voter registration data and information on foreigners in the country; receiving regular reports and specific requests for security force actions from local administrations; and rescinding municipal and provincial orders, when deemed necessary.",A1_ppt_entity_gathered,statistical data
label," On July 4, 2016, Deputy Prime Minister and National Defense Minister General Tea Banh reiterated that the government's national defense policy required the RCAF to block any ""color revolution,"" a label the CPP continued increasingly to apply to all peaceful demonstrations.",A0_pag_caller,Tea Banh,A1_ppt_item_being_labelled,capital,A2_prd_attribute,capital
philanthropy," And Hun Sen has never ceased to contrast Chinese aid offered ""without strings"" with aid from Western nations tied to conditions. In a stiffer response to the coup in Cambodia by Co-Prime Minister Hun Sen, the United States is planning to suspend all aid except basic humanitarian assistance until after elections can be held, senior American officials said today. This announcement was backed up by the United States' decision to suspend its aid to Cambodia for a period of 30 days as well as sanctions imposed by other countries. About 50 percent of the Cambodian national budget comes from foreign aid of one kind or another, either bilateral or through multilateral institutions like United Nations agencies and the World Bank. And Hun Sen has never ceased to contrast Chinese aid offered ""without strings"" with aid from Western nations tied to conditions. While final decisions are still to be made by Secretary of State Madeleine K. Albright and President Clinton, the officials said, there was a growing consensus that a fuller suspension of aid , tied to fresh elections held under international monitoring, is the only way to prevent Mr. Signed in Phnom Penh, 20 November 1991  In the name of FUNCINPEC, Norodom Ranariddh  In the name of the CPP, Hun Sen  From Pol Pot's perspective, an American plot was being hatched to divert the quadripartite Paris agreements into a bipartite (CPP-FUNCINPEC) accord, through which western aid would sustain the SoC structures and fund them to destroy the Khmer Rouge. And Hun Sen has never ceased to contrast Chinese aid offered ""without strings"" with aid from Western nations tied to conditions. He said the government could not expect international aid to maintain its administration if it refused to accept the election results, ""however painful they may be.""",A0_pag_helper,capital,A1_ppt_project,capital,A2_gol_benefactor,capital
salary," While there may be no repeat of the ""no taxation without representation"" ethos (which appears to be confined to American history) but one might expect a greater recognition going forward amongst Cambodian taxpayers that it is their money, and not the ruling party's, that is paying for new infrastructure and social services.",A0_pag_payer,capital,A1_ppt_entity_remunerated,Cambodian taxpayers,A2_mnr_compensation,money
proposal," At an April 30 meeting of CPP leaders, Hun Sen proposed a strike at Funcinpec's ""machinery"" before Anlong Veng forces could strengthen the royalists, or the arrest of Prince Ranariddh for negotiating with the guerillas, according to Brad Adams, who in 1997 was an official at the UN human rights office in Phnom Penh, and who wrote a piece in 2007 marking the 10th anniversary of the fighting. Rob Elliott/AFP  Coup de force  While Ke Kim Yan had the power as military commander to rebuff Hun Sen's proposals to attack Funcinpec in April 1996, in the background the second prime minister was steadily building up his own personal forces within both the country's police and the military.",A0_pag_proposer,capital,A1_ppt_proposition,capital,A2_gol_who/what_arg1_applies_to,capital
elaboration," In January 1996, the legal authority of the Ministry of National Defense was defined in a brief law that stated it was ""competent to lead and govern in the realm of national defense,"" but said nothing specifically about its authority over the armed forces, apparently leaving existing elaborations in administrative law and practice intact.",A0_pag_speaker,ministry,A1_ppt_subject_gone_into_detail_on,capital
voting," Advertisement  As Cambodians prepared to vote in June's commune election, Prime Minister Hun Sen delivered a warning. If anybody does not support the CPP, submit applications of resignation, and I can help you [with that] … But if you are loyal to the CPP you must vote for the CPP, and then you can stay Minister of Social Affairs Vong Sauth  Consider, for instance, Dith Munty, the Supreme Court chief justice who forcibly dissolved the opposition CNRP. The two wanted to change the constitution to allow lawmakers to vote in the entire government at once in a ""package vote"", believing that such a move would provide the needed support for a coalition government. The two wanted to change the constitution to allow lawmakers to vote in the entire government at once in a ""package vote "", believing that such a move would provide the needed support for a coalition government. The two wanted to change the constitution to allow lawmakers to vote in the entire government at once in a ""package vote"", believing that such a move would provide the needed support for a coalition government.",A0_pag_agent_voter,lawmakers,A1_ppt_theme_candidate_or_ballot_issue,capital
degradation," Such police repression was carried out via routine abuse of human rights, including torture and cruel, inhuman or degrading treatment, prolonged arbitrary detention without charge or trial, or unfair trials.",A0_pag_causer_of_degradation,capital,A1_ppt_entity_degraded,capital,A2_mnr_instrument,capital
investment," Moreover, once the UN had invested its resources and credibility in Cambodia, it needed the CPP more than the other way around.",A0_pag_investor,UN,A1_ppt_thing_invested,resources and credibility,A2_gol_invested_in,capital
indirection," Article 15 gave the prime minister(s) the power to appoint, transfer, and remove ""high-ranking"" military and other officials without reference to other authorities. Article 15 gave the prime minister(s) the power to appoint, transfer, and remove ""high-ranking"" military and other officials without reference to other authorities.",A0_pag_person_making_reference,capital,A1_ppt_thing_referenced,other authorities
turning," To shore up his party's power, the prime minister once again turned to his loyal security apparatus.",A0_pag_turner,capital,A1_ppt_thing_turning,capital
gathering," For the same reasons, despite gathering evidence of widespread human rights abuses, UNTAC could not penetrate the wall of official impunity.",A0_pag_agent_or_causer,evidence,A1_ppt_entity_gathered,capital
prestation," Our principle is that we have to deal with whichever government is in Phnom Penh"".",A1_ppt_obligated,ASEAN,A2_prd_obligation,deal with whichever government is in Phnom Penh
oversight," In December 1988, Hun Sen oversaw another military reshuffle: Tea Banh took over from Koy Buntha as Minister of National Defense, a post Tea Banh has held ever since. In these capacities, Pol Saroeun oversaw the creation and operation of a provincial security apparatus, including detention facilities where people accused of opposition to the PRK and the Vietnamese occupation were held indefinitely without charge or trial.",A0_pag_supervisor,capital,A1_ppt_thing_supervised,another military reshuffle
political_agitation," peace-keeping mission here and Cambodia's main contending parties, an agitated Prime Minister Hun Sen said that alleged ""electoral irregularities"" must be resolved before a constitution can be adopted and a new government created under a 1991 U.N.-sponsored peace plan.",A0_pag_causer,capital,A1_ppt_experiencer,capital
hiatus," We call on you to demonstrate good faith by taking immediate steps to halt the killing, arrest and harassment of peaceful political activists in Cambodia.",A1_ppt_Theme,capital
experience," There would be civil war if his party lost, he said, adding later: ""To ensure the lives of millions of people, we are willing to eliminate 100 or 200 people because we have seen bitter past experiences .""",A0_ppt_experiencer,people,A1_cau_experienced,capital
referendum," The 1997 coup and 1998 ballot were followed by further CPP-manipulated national assembly elections in 2003, 2008, and 2013, which the CPP claimed to have won by greater or lesser margins and in the course of which CPP neutralized FUNCINPEC, rendering it politically moribund.",A0_pag_voter,1998 ballot,A1_ppt_candidate_or_ballot_issue,"further CPP-manipulated national assembly elections in 2003, 2008, and 2013",A2_prd_numerical_count_of_vote,capital,capital
deficiency," At the appointment ceremony, Hun Sen tasked Kim Yan with ending illegal logging within three months - a tall order - with one military analyst suggesting at the time that Kim Yan's new deputies' lack of loyalty showed he was being ""set up for the kill"".",A0_pag_non,deputies,A1_ppt_thing_lacked,loyalty
grappling_hold," Realizing he had been vulnerable to ouster by CPP-controlled security forces, Hun Sen has since made the GRK one of the most important mainstays of his hold on power.",A0_pag_holder,capital,A1_ppt_thing_held,capital
confirmation, Subsequent events over 1992 and 1993 - particularly UNTAC's failure to control the SoC structure and the creation of a CPP-FUNCINPEC coalition government after the elections - only confirmed Pol Pot in his analysis.,A0_pag_confirmer,capital,A1_ppt_thing_confirmed,capital,A2_gol_benefactive,capital
disrepair," THE Phnom Penh headquarters of Cambodia's royalist party, FUNCINPEC, presents a dismal sight: party signs lie buckled and broken in the road outside, the compound wall is pocked with bullet holes, debris from ransacked offices blows about in the wind and the armed occupants have stripped the air-conditioners and pulled out the window frames.",A0_pag_breaker,armed occupants,A1_ppt_thing_broken,party signs
description," So if Hun Sen was to utter the chilling words ""l'etat, c'est moi"" of French monarch Louis XIV, it would be a rather accurate description of the state of Cambodia today.",A0_pag_describer,capital,A1_ppt_thing_described,capital
court_order," With regard to the latter, he issued an ""absolute order"" that the armed forces must ""ensure there will be no color revolution"" in Cambodia - a reference to various anti-government upheavals in Eastern Europe - and that they must do so by ""eliminating acts by any group or party"" deemed ""illegal.""",A0_pag_forcer,capital,A1_gol_impelled_agent,capital,A2_ppt_impelled_action,capital
control," Realizing he had been vulnerable to ouster by CPP- controlled security forces, Hun Sen has since made the GRK one of the most important mainstays of his hold on power.",A0_pag_controller,capital
settlement," No durable political settlement will be found to the current crisis without adequate guarantees and safeguards for human rights. UNTAC-era Abuses  In October 1991, SOC, FUNCINPEC, a second non-communist opposition group (the Khmer People's National Liberation Front), and Pol Pot's Khmer Rouge signed the Paris ""Agreement on a Comprehensive Political Settlement of the Cambodia Conflict,"" which was also signed by 18 foreign governments. Accord between the Cambodian People's Party (CPP) and the National United Front for an Independent, Neutral, Peaceful and Cooperative Cambodia (FUNCINPEC)  In view of effectively implementing the Agreement on a political settlement and promoting mutual trust;  In view of maintaining political stability in Cambodia and creating conditions favouring the accomplishment of His Royal Highness Samdech Norodom Sihanouk's noble mission in the service of the nation;  The Cambodian People's Party represented by H.E.",A0_pag_alterer,capital,A1_vsp_thing_distorted,capital
marginalisation," However, before the force was operational Sihanouk had become politically marginalized . With a view to exerting simultaneous control over the forces of these parts of the ministry and also to marginalize Sar Kheng, Hun Sen began pushing to have his personal ""Advisor for Interior and National Security Affairs,"" Em Sam-an, appointed to the Interior Ministry.",A0_pag_causer,capital,A1_ppt_unimportant_thing,capital
leadership," In fact, Hun Sen's proposal, according to Adams, ""was reportedly opposed by most CPP leaders , including Ke Kim Yan, Chea Sim and Sar Kheng.",A0_pag_leader,capital,A1_ppt_entity_lead,capital
challenge," These facts might explain the serial courses of action that Hun Sen has taken to neuter any effective political challenge from his opponents, most particularly the dissolution of the opposition Cambodia National Rescue Party.",A0_pag_challenger,capital,A1_ppt_challenged,capital
voting," ""You have been learning under the schools of samdech; how come you don't vote for samdech?"" ""How can you vote for the others when they have never built schools for you?",A1_ppt_theme_candidate_or_ballot_issue,others
indirect_tax," While there may be no repeat of the ""no taxation without representation"" ethos (which appears to be confined to American history) but one might expect a greater recognition going forward amongst Cambodian taxpayers that it is their money, and not the ruling party's, that is paying for new infrastructure and social services.",A0_pag_taxer,Cambodian taxpayers,A1_vsp_amount_of_tax,money,A2_gol_taxpayer,capital
contributing_factor," But it is a nation desperately in need of commerce; even the $20 visa fees paid by arriving tourists have been a significant contribution . The Kingdom of Cambodias membership will be a substantial contribution to this endeavour. Within days of the outbreak of violence, Hanoi expressed appreciation of Hun Sen's ' contribution ' to the 'consolidation of friendship and cooperative relations between the two states'. Article 4: The two parties agree to build on this cooperation to lay a solid basis for realising national reconciliation and contributing to social stability.",A0_pag_giver,capital,A1_ppt_thing_given,capital,A2_gol_entity_given_to,capital
social_inclusion," Capable of using ""infantry weapons,"" including sniper rifles, it was assigned to participate together with the army in ""fending off evil situations"" that might be created by ""unfriends"" of the government and others ""of an opposition tendency"" whenever the ordinary police were unable to handle such situations.",A1_ppt_theme,sniper rifles
joining_technology," The general moreover emphasized that ""the army must join together with the citizenry in each locality with the aim of strengthening national solidarity to fend off in a timely manner extremist forces that are fomenting instability in national society and in particular absolutely to pre-empt the fomenting of turmoil or any activity the mentality of which is desirous of destroying the peace, which must be immediately eliminated.""",A0_pag_agent,army,A1_ppt_first_thing_being_tied,citizenry,A2_ppt_second_thing,capital
sharing," However, it granted the prime minister authority to lead Cambodia's military and security work, sharing responsibility for the former with Minister of National Defense Tea Banh but giving new Minister of Interior Sar Kheng (Chea Sim's brother-in-law), an ex-East Zone Khmer Rouge and veteran CPP civilian administrator without security force experience, no responsibility for the latter.",A0_pag_sharer,capital,A1_ppt_thing_shared,capital,A2_com_shared_with,Tea Banh
accusation," Some were allegedly involved with the anti-PRK guerrilla campaign of Khmer Rouge remnants or with non-Communist anti-PRK insurgent groups, while other detainees were accused of non-violent political dissent.",A0_pag_agent_accuser,other detainees,A1_ppt_theme_accused,other detainees,A2_prd_attribute_crime,non-violent political dissent
legislative_election," Hun Sen's youngest son, Hun Many, was elected as a lawmaker in 2013, and heads the CPP's youth wing.",A1_ppt_candidate,lawmaker
performed_music," Each is politically and personally close to Hun Sen and helps ensure that the army, gendarmerie, and police perform a political role in guaranteeing his and the CPP's continued rule.",A0_pag_performer,army,A1_ppt_performance,mediatory role
knife_fight," The PRK was opposed by the Khmer Rouge, which reformed and fought an almost continuous guerrilla war against the Cambodian government from 1979 to 1998, the year Pol Pot died amidst the collapse of the Khmer Rouge movement.",A0_pag_fighter,capital,A1_ppt_thing_repelled,capital
finding," Prince Ranariddh, who got away to Thailand the day before the shooting started, finds himself in exile trying to whistle up support from foreign governments.",A1_ppt_thing_found,capital
come, Mr Hun Sen likes to emphasise that nobody forced Prince Ranariddh to leave and no one is stopping him from coming back—if he is ready to face the country's less than independent courts.,A4_gol_end_point,exile
social_inclusion," Ke Kimyan was named chief of the armed forces Supreme (akkeak) General Staff, whose deputies included general officers from both FUNCINPEC and the CPP.",A1_ppt_theme,deputies,A2_gol_group,general officers
defense," The most important were Defense of Political Security Directorate 1 (codenamed S21), now called the Anti-Terrorism Directorate, and Defense of Political Security Directorate 2 (codenamed S22), now called the Intelligence Directorate. At the same time, the Ministry of Interior was expanded into 20 directorates, two of which were most important for carrying out the ministry's own special political policing work: ""the Counter-Intelligence Directorate ('Political Defense 1')"" and ""the Anti-Reactionaries Directorate ('Political Defense 2')."" At a ceremony on February 2, 2017, the defense minister followed up with an appeal to all armed forces personnel ""not to believe in incitement by the opposition party."" The most important were Defense of Political Security Directorate 1 (codenamed S21), now called the Anti-Terrorism Directorate, and Defense of Political Security Directorate 2 (codenamed S22), now called the Intelligence Directorate. RCAF's involvement in general security affairs at all levels was laid down in a statute declaring that, ""when circumstances necessitate, the RCAF shall be able to participate in the defense of public security."" At the same time, the Ministry of Interior was expanded into 20 directorates, two of which were most important for carrying out the ministry's own special political policing work: ""the Counter-Intelligence Directorate ('Political Defense 1')"" and ""the Anti-Reactionaries Directorate ('Political Defense 2')."" In 1979, before the RPPK revealed itself, Pen Sovan was first PRK Minister of National Defense and Supreme (akkeak) Commander of the RPAFK. On July 4, 2016, Deputy Prime Minister and National Defense Minister General Tea Banh reiterated that the government's national defense policy required the RCAF to block any ""color revolution,"" a label the CPP continued increasingly to apply to all peaceful demonstrations. Among the various figures who came to prominence in the military and defense realms in the 1986-1988 period, only Pol Saroeun was an ex-East Zone CPK army defector linked to Hun Sen. Defense of Political Security 4 was generally responsible for guarding SOC installations and gatherings, whereas the separate Bodyguard Directorate was responsible for the close protection of particular individuals and groups of individuals. According to a senior French official stationed in Cambodia at the time, French ""police and defense attaches wrote many reports about Kieng Savut. In the rejigged nomenclature, Defense of Political Security 1 was responsible for what was called ""anti-sabotage,"" which meant ""fighting other parties/factions,"" including by deployment of elite mobile units anywhere in the country. The former Defense of Political Security directorates were given new names.",A0_pag_defender,capital,A1_ppt_defended,20 directorates,A3_gol_entity_defended_against,capital
rejection," Hok Longdy, who led a faction of the police in the July 1997 coup (Sar Kheng refused to participate), remained as Supreme Director and then Supreme Commissioner of National Police until his death in a helicopter crash in November 2008, after which he was replaced by Hun Sen's nephew-in-law Neth Savoeun.",A2_gol_theme_anti_benefactive,participate
knife_fight," However, these were not at full strength, and the total number of men under Hun Sen's command, who were designated as responsible for fighting in that part of Cambodia east of the Mekong River, was only 100.",A0_pag_fighter,men,A1_ppt_thing_repelled,fighting
protest_march," No protesters could be seen in the area Sunday afternoon and military personnel appeared calm and relaxed.""",A0_pag_protester,protesters
rejection, China has announced this Tuesday that it withdraws its offer to buy more than a million tons of rice while the government bank has joined the lenders that refuse to give more credit to the Executive.,A0_pag_agent_entity_refusing,lenders,A2_gol_theme_anti_benefactive,lenders
lobbying," The army took Sukanya Phrueksakasemsuk, wife of Somyot who's been campaigning for political prisoners, and his son Panitan Phrueksakasemsuk, 4th year Law student from Thammasat University, also a student activist.",A0_pag_asker,Sukanya,A1_ppt_favor,political prisoners
constraint," The rapid speed and severity with which these restrictions were put in place makes Thailand notorious worldwide for the unjust actions by the coup group. The scholars, who are from 20 institutions in 8 countries, believe that given the restrictions placed on freedom of expression inside the country, it is important for those outside the country to speak out against the coup.",A0_cau_preventer,restrictions,A1_ppt_Theme,nation
elected," Tida, dressed in a red silk jacket, refers to the demonstrators who, through camping and protests, have been demanding for three months in the streets of the capital that the elected government (now interim) be replaced by a committee of wise men to eradicate the corruption that eats away at the system, starting with Taksin and his entire family.",A0_pag_agent_voters,demonstrators,A1_ppt_theme_candidate,nation,A2_prd_result_office_or_position,committee of wise men
reporting," ""Exclusive: Fugitive Thai minister says army led government into trap"", Reuters, May 25, 2014  9.10pm: The army has summoned more people in its army announcement:  5 academics summoned by coup makers | Prachatai English http://t.co/ikpJxOZvFw via @prachatai_en #thaicoup — Prachatai English (@prachatai_en) May 25, 2014  NCPO orders Premchai Kanasutra, Srettha Thavisin and Anant Asavabhokhin and about 30 other persons to report to the council tomorrow.",A1_ppt_thing_reported,about 30 other persons,A2_gol_entity_reported_to,military
leadership," From there, he controls the government led by his little sister, Yingluck Shinawatra.",A0_pag_leader,military,A1_ppt_entity_lead,nation
public_speaking, Here are some of the main stories from today:  * Thai troops detain ousted govt minister who criticized coup - The troops detained Education Minister Chaturon Chaisang on Tuesday after entering a conference room at the Foreign Correspondents' Club of Thailand in Bangkok where he was speaking .,A0_pag_talker,Thai troops,A1_ppt_subject,coup d'état
maneuver, That is why it raised blisters among part of the movement that Taksin maneuvered so that his sister introduced an amnesty law that exonerated those linked to that mobilization the possibility of him returning to Thailand.,A0_pag_director,he,A1_ppt_entity_maneuvered,amnesty law,A2_gol_destination,his sister
approval," They are red because it is the color that they encouraged those who were against the Constitution approved in 2007 under the tutelage of the military to wear, explains one of its leaders at the headquarters.",A0_pag_approver,those,A1_ppt_thing_approved,the Constitution
reporting, But 3BB users reporting they can still access it.,A0_pag_Reporter,they can still access it,A1_ppt_thing_reported,they can still access it
anti-discrimination," They are red because it is the color that they encouraged those who were against the Constitution approved in 2007 under the tutelage of the military to wear, explains one of its leaders at the headquarters.",A0_ppt_opposer,those,A1_ppt_thing_opposed_to,the Constitution
protection," In a statement, AHRC said it ""unequivocally condemns the coup and wishes to express grave concern about the rapid decline of human rights protections it has engendered.",A0_pag_protector,AHRC,A1_ppt_protected,more,A2_ppt_danger,rapid decline of human rights
voting," The question is what will happen if there is finally what in Thailand is called a ""legal coup"", the annulment of the vote or the legal dissolution of the party.",A0_pag_agent_voter,nation,A1_ppt_theme_candidate_or_ballot_issue,vote
reading, Read MoreIs political violence in Thailand set to spiral? Read MoreThailand's growth outlook goes under the knife    Thailand has been stuck in political limbo since Prime Minister Yingluck Shinawatra and nine of her ministers were dismissed on May 7 after a court found them guilty of abuse of power. Read more >>,A1_ppt_thing_discussed,MoreThailand's growth outlook goes under the knife
nuclear_explosion," 8.42pm Thai Rath reports 3 dead and 52 injured from the explosions in Pattani. pic.twitter.com/hg2cN5xZrL — Suluck Lamubol (@FaiSuluck) May 24, 2014  8.37pm: At least three people are believed to have died after a string of explosions in the southern Thai city of Pattani this evening.",A1_ppt_bomb,explosions in Pattani
