involvement," The government managed to perform relatively well, especially in handling the initial wave of COVID-19 but was forced out of office after several months due to accusations of a conflict of interest involving the prime minister.",A0_pag_causer_of_inclusion,ouster,A1_ppt_theme,conflict of interest,A2_ppt_group,prime minister
legal_case," It follows months of deadlock and disputes pitting Saied, seen as a political outsider, against Prime Minister Hichem Mechichi and a fragmented parliament as Tunisia has descended into an economic crisis exacerbated by the COVID-19 pandemic.",A0_pag_first,deadlock,A1_com_second_arguer,Hichem Mechichi,A2_ppt_topic,deadlock
political_corruption," Despite this pluralism on paper, in each election many parties seemed indistinguishable, especially regarding voters' everyday concerns such as unemployment, regional inequalities, purchasing power, the quality of public services and corruption . Many Tunisians currently expect Saied to lead a major anti- corruption legal campaign.",A0_pag_agent/cause,himself,A1_ppt_entity_corrupted,corruption
involvement," Ennahdha said it holds President Saied and his interior minister fully responsible for Bouziane's death and said it will prosecute those involved in the ""crime"".",A1_ppt_theme,President Saied and his interior minister,A2_ppt_group,death
speech," But I'm against the arrest of Yassine Ayari because it is about freedom of speech . But I'm against the arrest of Yassine Ayari because it is about freedom of speech . A police officer gestures as supporters of Tunisia's biggest political party Ennahda, gather near the parliament building in Tunis, Tunisia July 26, 2021 [Zoubeir Souissi/Reuters]  Amnesty International  Human rights group Amnesty International urged Saied to ""publicly commit to respecting and protecting human rights, including the rights to freedom of expression , association and peaceful assembly"". A police officer gestures as supporters of Tunisia's biggest political party Ennahda, gather near the parliament building in Tunis, Tunisia July 26, 2021 [Zoubeir Souissi/Reuters]  Amnesty International  Human rights group Amnesty International urged Saied to ""publicly commit to respecting and protecting human rights, including the rights to freedom of expression, association and peaceful assembly"".",A0_pag_lecturer,MP Ayari,A1_gol_audience,Alaa,A2_ppt_topic_or_utterance,freedom of speech
accusation," Two of the other main parties in parliament, Heart of Tunisia and Karama, joined Ennahda in accusing Saied of a coup. He rejected accusations of a coup. The government managed to perform relatively well, especially in handling the initial wave of COVID-19 but was forced out of office after several months due to accusations of a conflict of interest involving the prime minister. Saied's one-man mission to rebuild Tunisia's broken political structures has sparked accusations that he is establishing a new dictatorship in the birthplace of the Arab Spring uprisings.",A0_pag_agent_accuser,himself,A1_ppt_theme_accused,himself,A2_prd_attribute_crime,himself
organizing," And despite the party's reputation as the best organized in Tunisia, for the last two years the party has appeared increasingly divided.",A0_pag_organizer,movement,A1_ppt_thing_organized,reputation
guarantee," broad resentment  In turn, the Ministry of Education issued a statement condemning this episode, which aroused widespread resentment in educational circles, and expressed through it its absolute solidarity with the abused professor, adding that it is working with all legal means to guarantee his material and moral rights, and is working to carefully monitor his health condition.",A0_pag_entity_making_guarantee,Ministry of Education,A1_ppt_guarantee,human rights,A2_gol_benefactive,the professor of history and geography
objection," Despite many political parties opposing his latest moves, Saeed is mainly counting on the ""huge popular support that he has till today,"" he added.",A0_pag_complainer,parties in parliament,A1_ppt_thing_objected_to,himself
abuse," broad resentment  In turn, the Ministry of Education issued a statement condemning this episode, which aroused widespread resentment in educational circles, and expressed through it its absolute solidarity with the abused professor, adding that it is working with all legal means to guarantee his material and moral rights, and is working to carefully monitor his health condition.",A0_pag_abuser,Ministry of Education,A1_ppt_entity_abused,the professor of history and geography
work," broad resentment  In turn, the Ministry of Education issued a statement condemning this episode, which aroused widespread resentment in educational circles, and expressed through it its absolute solidarity with the abused professor, adding that it is working with all legal means to guarantee his material and moral rights, and is working to carefully monitor his health condition.",A0_pag_worker,Ministry of Education,A1_ppt_job,himself
encouragement," When Democratic Elections Do Not Lead to Accountable Governments  Beginning in 2011, Tunisia established a system designed to encourage pluralism and checks and balances after decades of single-party authoritarian rule. According to Abbou, the political class writ large is unreliable and dishonest, and the only way to save Tunisian democracy is to encourage the honest president of the country to take radical measures.",A0_pag_convincer,himself,A1_ppt_impelled_agent,himself,A2_prd_impelled_action,checks
lying, At the core of debates over the political system lies a key disagreement.,A1_ppt_entity_in_the_position,deadlock,A2_loc_location,key disagreement
legislative_election," Many Tunisians blame those ills on a corrupt, self-interested political elite, and they see Saied, an independent elected in 2019, as a champion for ordinary people.",A1_ppt_candidate,himself,A2_prd_office_or_position,himself
outreach," Distinguishing himself from the exercise of platform-building supposedly practiced by the country's parties, Saied emphasized that he offered no promises save a project to establish a decentralized, participatory democracy.",A0_pag_entity_offering,himself,A1_ppt_commodity,promises
explanation," But politically, I agree with him… The Mechichi government only did things for their own sake,"" he explained .",A0_pag_explainer,Mohammed,A1_ppt_thing_explained,The Mechichi government only did things for their own sake
unveiling," ""At the protests, we present a frontline against the backsliding toward dictatorship,"" said Ghaylen, a 24-year old political activist from Sidi Hassine who has been attending protests all year. ""At the protests, we present a frontline against the backsliding toward dictatorship,"" said Ghaylen, a 24-year old political activist from Sidi Hassine who has been attending protests all year.",A0_pag_agent,police,A1_ppt_thing_shown,police,A2_gol_viewer,Alaa
investment," Party Organizations That Were Not There  Politicians did not invest in constructing durable party organizations either. Unlike Nidaa, Ennahda seemed to invest more resources and effort in building institutions.",A0_pag_investor,party,A1_ppt_thing_invested,building institutions,A2_gol_invested_in,building institutions
death," Samir Ben Amor, a lawyer for arrested protesters, also said Bouziane died due to police violence, though no more specifics were given. Ennahdha said it holds President Saied and his interior minister fully responsible for Bouziane's death and said it will prosecute those involved in the ""crime"". ""Ridha Bouziane, who took part in the January 14 protest, died in a hospital in the capital after suffering serious injuries as a result of the excessive violence by police in the demonstration,"" the Citizens Against the Coup coalition said. The court said the man's body bore no visible signs of violence and would be handed to forensic examiners to determine the cause of death . A Tunisian man has died in hospital from injuries inflicted by police, activists and the main opposition Ennahdha party said, in what would be the first death related to protests against President Kais Saied's assumption of extra powers. As for the new police station, after mass, arbitrary arrest sweeps and excessive use of tear gas in residential neighborhoods at night in January and the death of Ahmed Ben Moncef Ben Ammar during a police encounter in June, many see the police generally as a repressive force. A Tunisian man has died in hospital from injuries inflicted by police, activists and the main opposition Ennahdha party said, in what would be the first death related to protests against President Kais Saied's assumption of extra powers. A Tunis court investigating the death said the man, found in a coma on Mohamed V Street in the capital, was taken to hospital on Friday and he died on Wednesday. A Tunis court investigating the death said the man, found in a coma on Mohamed V Street in the capital, was taken to hospital on Friday and he died on Wednesday. As for the new police station, after mass, arbitrary arrest sweeps and excessive use of tear gas in residential neighborhoods at night in January and the death of Ahmed Ben Moncef Ben Ammar during a police encounter in June, many see the police generally as a repressive force.",A1_ppt_the_deceased,boy,AM_cau__cause,police encounter
buy," Instead, locals allege that the dump was used for politicians' shady business, as they took advantage of the foul smells to buy land cheaply and then sell at much higher prices.",A0_pag_buyer,politicians,A1_ppt_thing_bought,land,A2_dir_seller,locals,cheaply
protest_march," Hundreds of people took to the streets of the Tunisian capital to protest President Kaïs Saied's recent decrees bolstering the already near-total power he granted himself two months ago. Thousands of supporters of Tunisian President Kais Saied rallied in the capital on Sunday to show their backing for his suspension of parliament and promises to change the political system, acts his critics call a coup. On Saturday, more than 100 Ennahdha party officials announced their resignations to protest the movement's leadership. Police used water cannon and batons against protesters on Friday, as Saied faced growing discontent over his suspension of parliament last July and subsequent rule by decree. A Tunisian man has died in hospital from injuries inflicted by police, activists and the main opposition Ennahdha party said, in what would be the first death related to protests against President Kais Saied's assumption of extra powers. If something like that happens, people will go out again and protest ."" The arrest and circumstances were confirmed to Meshkal by Nawres Douzi, who works for the Tunisian League for Human Rights (LTDH)-a group that was observing the protest and have video evidence of the incident. Chawashi said that if Saied ""insists on his decisions"", the coalition would apply pressure and ""exercise all peaceful means of protest "". ""Ridha Bouziane, who took part in the January 14 protest, died in a hospital in the capital after suffering serious injuries as a result of the excessive violence by police in the demonstration,"" the Citizens Against the Coup coalition said. If something like that happens, people will go out again and protest ."" ""At the protests, we present a frontline against the backsliding toward dictatorship,"" said Ghaylen, a 24-year old political activist from Sidi Hassine who has been attending protests all year. The arrest and circumstances were confirmed to Meshkal by Nawres Douzi for the Tunisian League for Human Rights (LTDH) who were observing the protest and have video evidence of the incident. Tunisian President Kais Saied's decision to suspend parliament and dismiss the prime minister sparked protests at home where the biggest political party decried it as a ""coup"". ""At the protests, we present a frontline against the backsliding toward dictatorship,"" said Ghaylen, a 24-year old political activist from Sidi Hassine who has been attending protests all year. ""At the protests , we present a frontline against the backsliding toward dictatorship,"" said Ghaylen, a 24-year old political activist from Sidi Hassine who has been attending protests all year. As Tunisian political commentator Habib M. Sayah suggested in an illuminating Twitter thread, Saied's actions are not a conventional coup in which dissent and protest are violently repressed—at least not yet. ""Ridha Bouziane, who took part in the January 14 protest , died in a hospital in the capital after suffering serious injuries as a result of the excessive violence by police in the demonstration,"" the Citizens Against the Coup coalition said. Demonstrators waved Tunisian flags and carried placards railing against Ennahda, the Islamist party that is the biggest in parliament and has acted as Saied's main antagonist. The demonstration in central Tunis was called in response to protests over the previous two weekends in the same location against Saied's actions. ""At the protests , we present a frontline against the backsliding toward dictatorship,"" said Ghaylen, a 24-year old political activist from Sidi Hassine who has been attending protests all year. ""We ask the president to dissolve parliament and hold accountable those who made the people suffer for a decade,"" Salem Ajoudi, one of the demonstrators , said. ""Ridha Bouziane, who took part in the January 14 protest, died in a hospital in the capital after suffering serious injuries as a result of the excessive violence by police in the demonstration ,"" the Citizens Against the Coup coalition said.",A0_pag_protester,Alaa,A1_ppt_objectionable_thing,himself
constraint," On narrow streets in summer heat regularly above 40 Celsius, many locals sit outside on plastic chairs to escape the heat of homes without air-conditioning, well into the night despite curfew restrictions .",A0_cau_preventer,curfew restrictions,A1_ppt_Theme,locals,A2_gol_secondary_predication_or_action,sit outside on plastic chairs
grasp," Now, the complex, which holds the only sports fields in Sidi Hassine and what was meant to be a park for families, is better known in the neighborhood for crime and drugs.",A0_pag_grasper,youth complex,A1_ppt_thing_grasped,sports fields
grasp," Now, the complex, which holds the only sports fields in Sidi Hassine and what was meant to be a park for families, is better known in the neighborhood for crime and drugs.",A0_pag_grasper,youth complex,A1_ppt_thing_grasped,sports fields
intimacy," A police officer gestures as supporters of Tunisia's biggest political party Ennahda, gather near the parliament building in Tunis, Tunisia July 26, 2021 [Zoubeir Souissi/Reuters]  Amnesty International  Human rights group Amnesty International urged Saied to ""publicly commit to respecting and protecting human rights, including the rights to freedom of expression, association and peaceful assembly"".",A1_pag_near_entity,stones,A2_ppt_in_relation_to,himself
experience," Tunisia has experienced a number of social, economic and political crises since embarking on an uncertain transition from authoritarian rule more than ten years ago.",A1_cau_experienced,himself
attendance," ""At the protests, we present a frontline against the backsliding toward dictatorship,"" said Ghaylen, a 24-year old political activist from Sidi Hassine who has been attending protests all year.",A0_pag_thing_attending,Alaa,A1_ppt_thing_attended,himself
attendance," ""At the protests, we present a frontline against the backsliding toward dictatorship,"" said Ghaylen, a 24-year old political activist from Sidi Hassine who has been attending protests all year.",A0_pag_thing_attending,Alaa,A1_ppt_thing_attended,himself
intimate_relationship, An important outstanding question relates to the sources of support for Saied's actions.,A1_ppt_thing_under_consideration,sources of support for Saied's actions
protection," Saied, who suspended parliament and seized executive power last summer in moves his foes called a coup, has for months been attacking the judiciary as part of a corrupt, self-serving elite that disdains ordinary people to protect its own interests.",A1_ppt_protected,judiciary,A2_ppt_danger,himself
minelaying," Although Saied's initial announcement raised the possibility that the president would restrict this exceptional period to 30 days, there is little indication that he will do so given that he has neither appointed a prime minister nor laid out a roadmap as civil society organizations pressed him to do.",A0_pag_layer,himself,A1_ppt_thing_laid,roadmap,A2_gol_location,civil society organizations
acting," ""We call on all Tunisian actors to respect the Constitution, its institutions and the rule of law.",A0_pag_player,parties in parliament,A1_prd_role,"respect the Constitution, its institutions and the rule of law"
adoption," Moreover, Saied appears to favor the adoption of a new constitution, likely featuring a presidential system.",A0_pag_haver_of_belief,himself,A1_ppt_belief,himself
rise," In the 2019 presidential elections, Saied rose to power on the wave of anti-partisanship.",A0_ext_causer_of_inception/rising_of_arg1,himself,A1_ppt_Logical_subject,himself,A2_ext_EXT,himself
war," At the same time, the country's leaders appeared to be locked in a turf war for control of state institutions.",A2_ppt_topic,control of state institutions
grappling_hold," Romdhane - who is the same age as Saied, 63 - is a former director at PromESsE, a higher education reform project, and has held senior positions at Tunisia's higher education ministry.",A1_ppt_thing_held,senior positions
targeting, That campaign would target and disgrace the main political parties and leaders of the country.,A0_pag_agent_targeter,campaign,A1_ppt_theme_thing_aimed_at,main political parties and leaders of the country
violent_crime, The Collapse of Tunisia's Party System and the Rise of Kais Saied  T  unisia is facing a massive constitutional crisis that is threatening its democracy—simultaneously the most competitive in the Arab world and deeply disappointing to many of its citizens.,A1_ppt_threat,himself
social_inclusion," Other initiatives in Sidi Hassine since the revolution in 2011 include the rebuilding of the police station which was burned down by protesters in 2011, renaming the ""School of November 7"" (the date that Ben Ali took power from Bourguiba) to the ""Ibn Abi Diyaf School"" and neglecting to do anything about the large waste dump on the neighborhood's outskirts, which was supposed to be closed years ago.",A0_pag_agent,initiatives,A1_ppt_theme,rebuilding,A2_gol_group,himself
attendance," Although their attendance is tracked by Al-Bawsala, a well-known non-governmental organization, deputies in the legislature who were elected in 2014 only attended around 70 percent of the plenary sessions on average. According to Al-Bawsala, the party's legislative bloc has had the highest rate of attendance and voting participation of any bloc in each of the three elected legislatures. Although their attendance is tracked by Al-Bawsala, a well-known non-governmental organization, deputies in the legislature who were elected in 2014 only attended around 70 percent of the plenary sessions on average.",A0_pag_thing_attending,deputies,A1_ppt_thing_attended,legislature's proceedings
growth, Few parties have managed to grow over the course of time. Few parties have managed to grow over the course of time.,A1_ppt_thing_grown,parties
escape," On narrow streets in summer heat regularly above 40 Celsius, many locals sit outside on plastic chairs to escape the heat of homes without air-conditioning, well into the night despite curfew restrictions.",A0_ppt_entity_escaping,locals,A1_loc_place_or_thing_escaped,heat of homes
interpretation," A spokesperson for the German Foreign Office said the suspension of parliament was based on a ""a rather broad interpretation of the constitution"".",A1_ppt_entity_interpreted,himself,A2_prd_attribute_of_arg1,a rather broad interpretation of the constitution
vital_signs," In this case, chiefs of both organizations were sitting at the table when Saied announced his actions on July 25 on live television, signaling their initial support.",A0_pag_shower,chiefs,A1_ppt_thing_seen/shown,initial support,A2_gol_seer,himself
governance," 'NEW SISI'  Though it has failed to deliver prosperity or good governance , Tunisia's democratic experiment since 2011 has stood in stark contrast to the fate of other countries where Arab Spring revolts ended in bloody crackdowns and civil war. But with voters turning out at a relatively high rate of roughly 45 percent, it seemed like the chastened governing party of Ennahda was headed to the opposition while the former opposition, Nidaa Tounes, had a mandate to govern. Four political parties in Tunisia have announced a coalition to oppose President Kais Saied's move to seize governing powers. Tunisians are waiting for Saied to propose, negotiate or proclaim a roadmap, with many hoping that he will do so in a way that maintains liberties but establishes good governance . But with voters turning out at a relatively high rate of roughly 45 percent, it seemed like the chastened governing party of Ennahda was headed to the opposition while the former opposition, Nidaa Tounes, had a mandate to govern . Regarding the political system itself, Tunisians are waiting for Saied to propose, negotiate or proclaim a roadmap, with many hoping that he will do so in a way that maintains liberties but establishes good governance . Some Denounce Arrest Of MP Ayari  Many expressed anger at the Parliament and its governing coalition—especially the Ennahdha party whose office in Sidi Hassine was vandalized and burned after July 25. Some Denounce Arrest Of MP Ayari  Many expressed anger at the Parliament and its governing coalition—especially the Ennahdha party whose office in Sidi Hassine was vandalized and burned after July 25.",A0_pag_governor,himself,A1_ppt_governed,himself
support," ""In terms of Ennahda, they have money and outside support , and they have members in all the important institutions.",A0_pag_helper,money and outside support,A1_ppt_person,movement
consideration," It was last considered by Parliament once again in October last year, but its adoption was postponed following mass protests. It was last considered by Parliament once again in October last year, but its adoption was postponed following mass protests.",A0_pag_agent,himself,A2_prd_for_what/secondary_predicate,himself
oratory," Recent polling suggests Saied's decisions enjoy broad popularity, and this appears to be true in Sidi Hassine where nearly all those Meshkal spoke with expressed their support and said they see it as an opportunity to get rid of a corrupt political elite.",A0_pag_talker,those Meshkal spoke with,A1_ppt_subject,broad popularity
choice, National elections turned out to be a poor mechanism for choosing highly accountable representatives or government.,A1_ppt_thing_picked,himself
finance, The country faces a rapidly looming public finance crisis after years of economic stagnation were aggravated by the coronavirus pandemic and political infighting.,A0_pag_financ,himself,A1_ppt_thing_financed,himself
identification," The exception is likely a lack of support among those who identify closely with Ennahda and Qalb Tounes, as well as some members of the political elite.",A0_pag_causer_of_change,those who identify closely with Ennahda,A1_ppt_thing_changing,those who identify closely with Ennahda,A2_gol_target,parties in parliament
approval," ""But the president has suspended Parliament - so he's appointed Najla Bouden Romdhane as prime minister, but there'll be no parliamentary approval of this,"" he said. It also requires approval by a constitutional court that has not yet been set up. Although it is difficult to accurately gauge approval for his move during an uncertain time, it appears to be popular, based on recent polling, popular celebrations following the announcement and a largely positive reception by many media outlets.",A0_pag_approver,himself,A1_ppt_thing_approved,himself
protest_tactic, More uncertainty shrouds Tunisia's political future than at any point since the mass protests of 2011's Arab uprisings overthrew President Zine El Abidine Ben Ali.,A0_pag_planner,himself,A1_ppt_thing_planned,post-party future,A2_cau_grounds_for_planning,himself
thrust," Al Jazeera's Bernard Smith, reporting from Tunis, said Romdhane will be under considerable pressure as she has been "" thrust right into the heart of the spotlight"".",A1_ppt_entity_pushed,Najla Bouden Romdhane,A2_gol_direction,the heart of the spotlight
artistic_inspiration," He was referring to the Islamist movement founded in Egypt in 1928 which inspired Sunni Islamists across the Arab world, including Ennahda.",A0_cau_causer_of_inspiration,founded in Egypt in 1928,A1_ppt_person,Sunni Islamists,A2_prd_inspired_action,founded in Egypt in 1928
parliamentary_opposition," On July 25, Saied invoked the constitution to seize executive power in what his main opponents , the Islamist-inspired Ennahdha party, denounced as a ""coup"".",A0_ppt_opposer,movement,A1_ppt_thing_opposed_to,himself
participation," The government, owned by no major political power and with no clear agenda, was unable to operate effectively, which paved the way for a series of ""national unity"" governments where all parties and independents were invited to take part .",A0_pag_agent,parties in parliament
delivery," 'NEW SISI'  Though it has failed to deliver prosperity or good governance, Tunisia's democratic experiment since 2011 has stood in stark contrast to the fate of other countries where Arab Spring revolts ended in bloody crackdowns and civil war.",A0_pag_sender,himself,A1_ppt_sent,himself,A2_gol_sent-to,himself
