protest_march," 12 hours ago (06:31 GMT)  Suu Kyi's party urges Myanmar's people to oppose 'coup'  The NLD released a statement from its chief Aung San Suu Kyi, saying the military's actions were unjustified and went against the constitution and will of voters. He said that one of around six protesters still detained inside the station asked him to convey to friends and family waiting outside that they too were safe. At least two people were injured at the protest where about 200 people had gathered outside the Myanmar embassy in Bangkok. 7 hours ago (11:05 GMT)  Thai police clash with protesters  Reuters witnesses said the police in Thailand clashed with a group of demonstrators who took to the street against Myanmar military's power grab. Soldiers were deployed to power plants in the northern state of Kachin, leading to a confrontation with demonstrators , some saying they believed the army intended to cut off the electricity. Riot police advance during a clash with anti-Thai government protesters at a rally for Myanmar's democracy outside the embassy, in Bangkok, Thailand [Athit Perawongmetha/Reuters]  7 hours ago (10:59 GMT)  ASEAN calls for ""return to normalcy""  The Association of Southeast Asian Nations (ASEAN) called for Myanmar to pursue ""dialogue, reconciliation and the return to normalcy"". 8 hours ago (09:58 GMT)  Protesters in Tokyo, Bangkok gather against coup  Hundreds of demonstrators , holding portraits of Aung San Suu Kyi, gathered in downtown Tokyo outside the United Nations University, calling on the international body to further condemn Myanmar military's actions. Activists hold a portrait of Myanmar's de facto leader Aung San Suu Kyi during a protest outside the United Nations University building in Tokyo [Philip Fong/AFP] ""I'm worried [about my family], but more than them I'm worried about Aung San Suu Kyi,"" Tin Htway, a 22-year-old restaurant worker who attended the protest, told Reuters. The security forces fired shots and tear gas to disperse protesters in Yangon. 04:58 Why Myanmar protesters see Aung San Suu Kyi as their greatest hope - video explainer  The army has been carrying out nightly arrests and on Saturday gave itself sweeping powers to detain people and search private property. It said the protesters were violent and attacked riot police. Although the military has banned gatherings of five or more people, demonstrations are continuing in various places in the country. During the series of demonstrations than began on Feb. There was a new rally in the southern city of Dawei, too, a verified livestream on Facebook showed, with hundreds of protesters accompanied by a marching band. NLD supporters shout slogans outside Myanmar's embassy during a rally in Bangkok, Thailand [Athit Perawongmetha/Reuters]  8 hours ago (09:48 GMT)  Myanmar health minister says leaving post  Myanmar's health minister said he was leaving his post because of the ""evolving situation"" in the country. 7 hours ago (11:05 GMT)  Thai police clash with protesters Reuters witnesses said the police in Thailand clashed with a group of demonstrators who took to the street against Myanmar military's power grab. Assistant surgeons from the 300-bed Children's Hospital in Mandalay earlier announced that they would protest in peace starting from February 3 as they do not want to work under the new military formed government. This is not the first time Cellebrite has been criticized for its involvement in suppressing peaceful protests . Since the coup, hundreds of thousands of people have taken to the streets to call for an end to Aung San Suu Kyi 's detention in the nation's biggest protests in more than a decade. Activists hold a portrait of Myanmar's de facto leader Aung San Suu Kyi during a protest outside the United Nations University building in Tokyo [Philip Fong/AFP] ""I'm worried [about my family], but more than them I'm worried about Aung San Suu Kyi,"" Tin Htway, a 22-year-old restaurant worker who attended the protest, told Reuters. The military takeover was met with massive public protests that has resulted in a lethal crackdown by security forces, who routinely fire live ammunition into crowds. After locals banged pots and pans to register their displeasure with the apparently organized march, some of them were attacked by pro-military protesters with slingshots and stones. Protesters gathered in Thailand's capital Bangkok as well to voice their dissent against the military's coup in Myanmar. Riot police advance during a clash with anti-Thai government protesters at a rally for Myanmar's democracy outside the embassy, in Bangkok, Thailand [Athit Perawongmetha/Reuters]  7 hours ago (10:59 GMT)  ASEAN calls for ""return to normalcy""  The Association of Southeast Asian Nations (ASEAN) called for Myanmar to pursue ""dialogue, reconciliation and the return to normalcy"". 00:51 Tens of thousands protest in Myanmar nine days after coup - video  On Sunday, police opened fire to disperse protesters at a power plant in northern Myanmar, but violence in this month's protests has been limited. Troops have joined police in forcefully dispersing marchers in the city of Mandalay in northern Myanmar, as protests against the military coup continued despite the deployment of extra soldiers in some areas and an eight-hour internet blackout overnight. The security forces fired to disperse protesters outside one plant in the state capital, Myitkyina, footage broadcast live on Facebook showed, although it was not clear if they were using rubber bullets or live fire. Activists hold a portrait of Myanmar's de facto leader Aung San Suu Kyi during a protest outside the United Nations University building in Tokyo [Philip Fong/AFP] ""I'm worried [about my family], but more than them I'm worried about Aung San Suu Kyi,"" Tin Htway, a 22-year-old restaurant worker who attended the protest , told Reuters. ""I urge people not to accept this, to respond and wholeheartedly to protest against the coup by the military."" There was a new rally in the southern city of Dawei, too, a verified livestream on Facebook showed, with hundreds of protesters accompanied by a marching band. There was no sign of overnight violence on Monday, but the country woke to extra troops on the streets of many cities including the former capital Yangon, where the new forces on the ground included the 77th light-infantry division which, during pro-democracy protests in 2007, was accused of ramming demonstrators and using live ammunition against them. A verified Facebook page for the NLD published comments it said had been written in anticipation of a coup, and which quoted her as saying people should protest against the military takeover. After nearly a decade of an often controversial democracy, Myanmar's forceful backslide into military rule has so far continued to stand strong despite widespread pro-democracy protests and strikes across the country. ""Before 1am we were still checking up on each other, calling to confirm that we were each in a safe place,"" said a protest organiser who came from a family of activists. Images and reports from the city on Monday showed police and soldiers using rubber bullets and slingshots to disperse protesters .",A0_pag_protester,massive public protests,A1_ppt_objectionable_thing,democratic reforms in Myanmar
legislation," 9 hours ago (09:24 GMT)  Myanmar lawmakers reportedly under guard  According to two lawmakers , security forces are guarding the residences of members of parliament in the country's capital Naypyidaw. 9 hours ago (09:24 GMT)  Myanmar lawmakers reportedly under guard  According to two lawmakers, security forces are guarding the residences of members of parliament in the country's capital Naypyidaw.",A0_pag_law-giving_body,lawmakers
confirmation," The third Israeli company mentioned in the article is Gaia Automotive Industries, whose armored vehicles military experts confirmed were used by the Myanmar military during the coup on February 1 in the capital Naypyidaw.",A0_pag_confirmer,military experts,A1_ppt_thing_confirmed,troops
parking," A truck carrying police officers parks in Yangon, Myanmar.",A0_pag_parker,police officers,A1_ppt_entity_parked,truck,A2_gol_parking_place,around the city
ranking," According to him, Aung San Suu Kyi and other high- ranking representatives of the party were detained in the early morning of February 1.",A0_pag_assigner,him,A1_ppt_thing_assigned_a_position,"the head of the country's ruling National League for Democracy (NLD) party, Aung San Suu Kyi"
violent_crime," ""This arrest, as well as the transfer of legislative, executive and judicial power to the army is an unacceptable threat to the democratic process that was started about 10 years ago,"" French Foreign Minister Jean-Yves Le Drian said in a statement. ""Patrolling with armoured vehicles means they are threatening people,"" said 46-year-old Nyein Moe, among the more than 1,000 gathered in front of the central bank in Yangon.",A0_pag_agent,Michel,A1_ppt_threat,democratic reforms in Myanmar
clarification, An NLD spokesman later clarified that the military was in the process of organizing a coup d'état.,A1_ppt_thing_becoming_clearer,democratic reforms in Myanmar
ban," Although the military has banned gatherings of five or more people, demonstrations are continuing in various places in the country.",A0_pag_lawgiver,democratic reforms in Myanmar,A1_ppt_activity/place/item_not_allowed,gatherings of five or more people
lockout," The army said the senior members of the National League for Democracy, including leader Aung San Suu Kyi, were detained by the military due to a dispute arising from elections held in November 2020 [Maung Lonlan/EPA]  1 hour ago (16:42 GMT)  'Everybody needs a strong, international response': UN rapporteur  Thomas Andrews, the UN special rapporteur on Myanmar, told Al Jazeera he is worried for the people of the country and the international community must condemn the military's coup in ""the strongest possible terms"".",A0_pag_agent,democratic reforms in Myanmar,A1_ppt_thing_excluded,"the head of the country's ruling National League for Democracy (NLD) party, Aung San Suu Kyi",A2_dir_excluded_from,National League for Democracy
promise," Myanmar's Military Leader Declares Himself Prime Minister And Promises Elections  Enlarge this image toggle caption Alexander Zemlianichenko/Pool AP Alexander Zemlianichenko/Pool AP  BANGKOK — Six months after seizing power from the elected government, Myanmar's military leader on Sunday declared himself prime minister and said he would lead the country under the extended state of emergency until elections are held in about two years.",A1_gol_goal_person_promised_to,Himself Prime Minister,A2_ppt_theme_promised_action,democratic elections
copyright_infringement," On the Israeli front, the article cited three Israeli defense manufacturers suspected of violating international arms embargoes: Elbit Systems, Cellebrite and Gaia Automotive Industries.",A0_pag_pirate,Israeli defense manufacturers,A1_ppt_thing_stolen,arms embargoes
risk," ""The military is now using those very tools to brutally crack down on peaceful protesters risking their lives to resist the military junta and restore democracy,"" Ma Yadanar Maung, a spokeswoman for the Justice For Myanmar group that monitors the Tatmadaw's abuses, told the Times.",A0_pag_entity_risking_something,protesters,A1_ppt_risky_action_undertaken,crack down on peaceful protesters,A2_ppt_thing_in_jeopardy,their lives
guarantee, The military should cease any further arrests and publicly guarantee the safety and well-being of those detained.,A0_pag_entity_making_guarantee,democratic reforms in Myanmar,A1_ppt_guarantee,safety and well-being,A2_gol_benefactive,leaders
taking_office," ""This arrest, as well as the transfer of legislative, executive and judicial power to the army is an unacceptable threat to the democratic process that was started about 10 years ago,"" French Foreign Minister Jean-Yves Le Drian said in a statement.",A0_pag_Agent,democratic reforms in Myanmar,A1_ppt_Theme,democratic reforms in Myanmar
patrol," "" Patrolling with armoured vehicles means they are threatening people,"" said 46-year-old Nyein Moe, among the more than 1,000 gathered in front of the central bank in Yangon.",A0_pag_patroller,troops,A1_loc_area,people
constraint, Limitations on oxygen sales have led to widespread allegations that the military is directing supplies to government supporters and military-run hospitals.,A0_cau_preventer,democratic reforms in Myanmar,A1_ppt_Theme,government supporters and military-run hospitals,A2_gol_secondary_predication_or_action,supplies
presence," ""The military junta that ruled Myanmar for decades never really stepped away from power in the first place … They never really submitted to civilian authority in the first place, so today's events in some sense are merely revealing a political reality that already existed ,"" Sifton said on Twitter.",A1_pag_entity_present,democratic reforms in Myanmar,A2_loc_where,situation
selling," In 2018 however, Israel was supposed to have blocked all military exports to the Southeast Asian nation, after reports emerged that alleged Israeli weaponry was being sold to the Myanmar Army, which had been accused of genocidal actions towards the Muslim Rohingya ethnic minority.",A1_ppt_Thing_Sold,all of his exports,A2_gol_Buyer,democratic reforms in Myanmar,A3_vsp_Price_Paid,alleged Israeli weaponry
inhabitation," Street vendors in the main city of Yangon scrambled to pack away their stalls as the curfew approached on Monday evening, Ben Small, a resident in the city, posted on Twitter.",A0_pag_resident,Small,A1_ppt_place_of_residence,around the city
support," ""Unlike an elected government, this military [government] will need international support to sustain. ""We know that is going to be a very unpopular move [the military coup], but to say that this will be translated into a popular movement is yet to be determined,"" Fowle said, adding that various influential public figures, from activists to artists, who could rally enough support have already been arrested.",A0_pag_helper,international,A1_ppt_person,democratic reforms in Myanmar
comment," 8 hours ago (10:14 GMT)  Pakistan 'hopes' for restrain Commenting on the coup in Myanmar, Pakistan Foreign Ministry said it hoped the two parties will ""engage constructively"".",A0_pag_commenter,Pakistan Foreign Ministry,A1_ppt_utterance,democratic reforms in Myanmar
license," Gaia Automotive head Shlomi Shraga told the Times that he had ""not seen"" any photos of Gaia's armored vehicles cruising through Naypyidaw, stressing that Israel's Defense Ministry licenses all of his exports.",A0_pag_granter_of_license,Israel's Defense Ministry,A1_ppt_licensed_thing,all of his exports
carpentry," According to the Times report, U Kyi Thar, chief executive of Myanmar Future Science, a company which claims to be an ""educational and teaching aid supplier ,"" confirmed that his company began the repair work on the drones in late 2019 and continued into 2020.",A0_pag_Person/Entity_working_something1,company,A1_ppt_Thing_undergoing_change_of_state,military grade Elbit drones,A2_prd_End_result_of_thing_worked,repair work
rural_flight," In the latest sign of disruption by workers, the government 's civil aviation department said in a statement many staff had stopped coming to work since 8 February, causing delays to international flights.",A0_pag_causer_of_urbanization,democratic reforms in Myanmar,A1_ppt_entity_urbanized,staff refused
governance," Students and Buddhist monks demonstrated in front of the troops, and a banner reading ""We do not want military government "" was stuck to an army vehicle outside Yangon's central bank. pic.twitter.com/X85HwTXh29 — Steve Herman (@W7VOA) February 1, 2021  Guterres said the elections last November provided a strong mandate for Suu Kyi's NLD to govern . ""The government of Mexico is following the events that occurred in the Union of Myanmar with great concern and echoes the condemnation of the UN Secretary General, António Guterres, for the arrest of the political leaders of that country. The Burmese Army has declared a state of emergency and taken political control of the country for a year after arresting several members of the Government , including the leader and Nobel Peace Prize winner in 1991, San Suu Kyi. 4 hours ago (14:28 GMT)  Military government names 11 new ministerial posts  Myanmar's military government has announced a purge of Aung San Suu Kyi's administration, removing 24 ministers and deputies and naming 11 replacements in its new administration after seizing power in a coup.",A0_pag_governor,democratic reforms in Myanmar,A1_ppt_governed,democratic reforms in Myanmar
release_from_prison," 12 hours ago (06:31 GMT)  Suu Kyi's party urges Myanmar's people to oppose 'coup'  The NLD released a statement from its chief Aung San Suu Kyi, saying the military's actions were unjustified and went against the constitution and will of voters. Late on Sunday, hours before Myanmar's new parliament was due to convene, the military released an aggressive statement again rejecting the results of November's election, which the National League for Democracy won in a landslide.",A0_cau_cause_releaser,democratic reforms in Myanmar,A1_ppt_theme_thing_released,democratic reforms in Myanmar
stripping," ""Late night raids; mounting arrests; more rights stripped away; another Internet shutdown; military convoys entering communities.",A0_pag_remover,internet outage,A1_ppt_thing_removed,rights
photograph," FILE PHOTO : Prime Minister Jacinda Ardern addresses supporters at a Labour Party event in Wellington, New Zealand, October 11, 2020.",A1_ppt_subject,Prime Minister Jacinda Ardern addresses supporters
release_from_prison," In the capital, Naypyidaw, protesters gathered outside a police station demanding the release of a group of high school students who were detained while joining in anti-coup activities.",A0_cau_cause_releaser,protesters,A1_ppt_theme_thing_released,high school students
growth, Casualties are also rising among the military and police as armed resistance grows in both urban and rural areas.,A0_pag_causer_of_growth_-_should_be_possible,armed resistance,A2_ext_amount_increased_by,rising
identification," A pilot, who asked not to be identified for fear of retribution, said hundreds of staff from the department were striking.",A0_pag_causer_of_change,pilot,A1_ppt_thing_changing,pilot,A2_gol_target,staff refused
leadership," Yesterday, the UN head strongly condemned the military takeover of the country and called for all leaders to act in the best interests of Myanmar's democratic reform, which in 2011 began a political transition to elected civilian government. New Zealand will also impose a travel ban on Myanmar's military leaders , and ensure its aid programme to the country will not include projects that are delivered with, or benefit, the military government, Ardern said in a news conference. #Myanmar #MilitaryCoup pic.twitter.com/w74aV1Ut1w — Htoo Tay Zar (@tayzar44) February 1, 2021  7 hours ago (11:30 GMT)  'Nothing short of outrageous': UN official  A United Nations official assigned to Myanmar has condemned the coup and urged an unequivocal response from world leaders . 11 hours ago (06:48 GMT)  US concerned about Myanmar developments  US Secretary of State Antony Blinken is expressing alarm about Myanmar's military detaining Aung San Suu Kyi and other civilian leaders . ""We call on Burmese military leaders to release all government officials and civil society leaders and respect the will of the people of Burma as expressed in democratic elections on November 8,"" Blinken said in a statement from Washington, DC. Crowds also gathered outside the headquarters of the National League for Democracy, the civilian party that won November's general election but whose top leaders , including Aung San Suu Kyi, were detained when the military took power on 1 February. Foreign Minister Nanaia Mahuta said in a separate statement that New Zealand does not recognise the legitimacy of the military-led government and called on the military to immediately release all detained political leaders and restore civilian rule. ""The government of Mexico is following the events that occurred in the Union of Myanmar with great concern and echoes the condemnation of the UN Secretary General, António Guterres, for the arrest of the political leaders of that country. Than Swe, president of the Union of Myanmar Citizen Association, said he wanted Aung San Suu Kyi and all other democratically elected leaders to be released immediately. ""The vote of the people must be respected and civilian leaders released,"" he added. 11 hours ago (06:40 GMT)  UN chief condemns military take of power  United Nations' Secretary-General Antonio Guterres has strongly condemned the detention of Myanmar's civilian leaders and expressed ""grave concern"" about all legislative, executive and judicial powers being transferred to the military.",A0_pag_leader,leaders,A1_ppt_entity_lead,leaders
pseudoscience," The military said the seizure was necessary because the government had not acted on its claims of fraud in November's elections [AFP]  1 hour ago (17:03 GMT)  Reporter's Notebook: Panic, anger and uncertainty in Yangon  I went to bed in a flawed democracy and woke up under military rule.",A0_pag_claimer,democratic reforms in Myanmar,A1_ppt_thing_claimed,claims of fraud in November's elections,A2_gol_hearer,democratic reforms in Myanmar
closure, The power grab came as Parliament - in which the military is given 25 percent of the seats - was set to open in Myanmar.,A0_pag_person_doing_the_closing,democratic reforms in Myanmar,A1_ppt_thing_closing,Myanmar's new parliament
amendment," The amendments to the penal code set out a 20-year prison term for inciting hatred of the government or military or hindering the security forces engaged in preserving state stability. Hindering the security forces carrying out their duties is punishable by seven years in prison while spreading fear, fake news or agitating against government employees gets three, according to the amendments posted on a military website. On Sunday, it published penal code amendments aimed at stifling dissent.",A0_pag_repairer,democratic reforms in Myanmar,A1_ppt_thing_repaired,amendments
dethronement, 04:58 Why Myanmar protesters see Aung San Suu Kyi as their greatest hope - video explainer  The army has been carrying out nightly arrests and on Saturday gave itself sweeping powers to detain people and search private property.,A0_pag_usurper,democratic reforms in Myanmar,A1_ppt_king,people
protection," ""China is a friendly neighbour of Myanmar and hopes the various parties in Myanmar will appropriately resolve their differences under the constitutional and legal framework to protect political and social stability,"" foreign ministry spokesman Wang Wenbin said at a daily news briefing.",A1_ppt_protected,state stability,A2_ppt_danger,differences
leadership," Those who are vulnerable: civil society leaders , organisations that support democracy and human rights, the Rohingya community, ethnic minorities around the country including those that are in conflict right now with the military … Everybody is in danger and everybody needs a strong, international response.""",A0_pag_leader,civil society leaders,A1_ppt_entity_lead,Rohingya community
food_preparation," ""We have to make preparations .",A1_ppt_creation,preparations
pointing," ""The banks have been closed, so there is a little bit of nervousness around that,"" she said, pointing to the fact that people in Myanmar largely rely on cash.",A0_pag_pointer,Al Jazeera's Ali Fowle,A1_ppt_thing_pointed,fact,A2_gol_pointed_at,people in Myanmar
walking," Local media showed pictures of Yuki Kitazumi, with a camera around his neck, walking out of the gates of the Sanchaung township police station after 4 p.m.",A0_pag_walker,Yuki Kitazumi
reporting," The report said that the day after the Times reporter posed ""extensive questions"" about the relationship between Cellebrite and MySpace International - which was founded by Dr. The report added that Senior Gen. The New York Times on Sunday published a report which claims that government budget records revealed that ""Israeli-made surveillance drones, European iPhone cracking devices and American software that can hack into computers and vacuum up their contents,"" were used by the generals to carry out their coup despite various sanctions and international arms embargoes which prohibit such systems from being exported to the country. The report also alleged that both Cellebrite and BlackBag denied any affiliation with a known ""middleman"" for international arms deals named Dr.",A0_pag_Reporter,report,A1_ppt_thing_reported,Myanmar's military leader,A2_gol_entity_reported_to,Myanmar's military leader
disobedience, The 'Civil Disobedience Campaign' was launched on February 2 and is a show of support for democracy and the civilian elected government .,A0_pag_disobeyer,democratic reforms in Myanmar,A1_ppt_rule_or_rule-giver,democratic reforms in Myanmar
genital_ectomy," ""The United States removed sanctions on Burma (Myanmar) over the past decade based on progress toward democracy,"" Biden said in a statement.",A0_pag_remover,United States,A1_ppt_entity_excised,fallen,A2_dir_excised_from,democratic reforms in Myanmar
release_from_prison," ""I hope all the prisoners will be released , not only me,"" he said.",A0_cau_cause_releaser,leaders,A1_ppt_theme_thing_released,Yuki Kitazumi
surveillance," We are monitoring the situation closely,"" it added.",A1_loc_thing_looked_at,the situation in Myanmar
